{
  "version": "1.0.0",
  "research_question": "Does vancomycin improve survival compared with alternative therapy in serious Gram-positive infections?",
  "design_summary": "Narrative review with systematic search; or single-center cohort if own data — replace with your actual design.",
  "reporting_checklist": "PRISMA if systematic review; STROBE if observational; CONSORT if RCT",
  "analysis_plan_summary": "Primary: survival at day 28 or hospital discharge per protocol; sensitivity analyses pre-specified in protocol.",
  "writing_outline": "IMRaD or chapter: Introduction, Methods, Results, Discussion",
  "sections_or_chapters": [
    {
      "id": "S1",
      "title": "Introduction",
      "passes": false
    },
    {
      "id": "S2",
      "title": "Methods",
      "passes": false
    },
    {
      "id": "S3",
      "title": "Results",
      "passes": false
    },
    {
      "id": "S4",
      "title": "Discussion",
      "passes": false
    }
  ],
  "milestones": [
    {
      "id": "M1",
      "title": "Finalize search strategy + register protocol (if SR)",
      "priority": "P0",
      "passes": false,
      "blocked_by": [],
      "kind": "methods",
      "maps_to_sections": ["S2"]
    },
    {
      "id": "M2",
      "title": "Primary analysis or synthesis + diagnostic checks",
      "priority": "P0",
      "passes": false,
      "blocked_by": ["M1"],
      "kind": "statistics",
      "maps_to_sections": ["S3"]
    }
  ]
}
